{
  "kind": "ui-result",
  "schemaVersion": 1,
  "status": "PASS",
  "reasons": [
    {
      "code": "UI_CRITERIA_HELD",
      "message": "1 file(s); the five static FAIL criteria held"
    }
  ],
  "app": {
    "appAlias": "hr"
  },
  "context": {
    "task": "T-42",
    "repo": {
      "commit": "0123456789abcdef0123456789abcdef01234567",
      "dirty": false
    },
    "frameworkVersion": "0.6.1",
    "timestamp": "2026-10-11T12:40:00Z",
    "producer": {
      "skill": "apex-ux",
      "method": "tool"
    }
  },
  "scope": "static",
  "files": [
    "apex/apexlang/hr/pages/p00010-employees.apx"
  ],
  "unparsed": [],
  "criteria": [
    {
      "id": "UX-ITEM-NAME",
      "status": "PASS",
      "findings": []
    },
    {
      "id": "UX-CONTROL-NAME",
      "status": "PASS",
      "findings": []
    },
    {
      "id": "UX-DESTRUCTIVE-CONFIRM",
      "status": "PASS",
      "findings": []
    },
    {
      "id": "UX-NO-INLINE-STYLE",
      "status": "PASS",
      "findings": []
    },
    {
      "id": "UX-NO-COMPOSED-CLASS",
      "status": "PASS",
      "findings": []
    }
  ],
  "advisories": []
}